{
  "schemaVersion": 1,
  "publishedAt": "2026-08-30T03:31:38.464Z",
  "assetBaseUrl": "/",
  "projects": [
    {
      "id": "moscow-golf-club-raevo",
      "slug": "moscow-golf-club-raevo",
      "year": "2026",
      "fileCode": "DDG-008",
      "category": "parks",
      "title": {
        "ru": "Гольф Клуб Раево",
        "en": "Raevo Golf Club"
      },
      "location": {
        "ru": "Раево, Московская область",
        "en": "Raevo, Moscow Region"
      },
      "collaboration": {
        "ru": "в сотрудничестве с компанией Дерево Парк",
        "en": "in collaboration with Derevo Park"
      },
      "coordinates": {
        "lat": 55.69,
        "lng": 37.03
      },
      "images": [
        "/portfolio/moscow-golf-club-raevo/g1.webp",
        "/portfolio/moscow-golf-club-raevo/g2.webp",
        "/portfolio/moscow-golf-club-raevo/g3.webp",
        "/portfolio/moscow-golf-club-raevo/g4.webp",
        "/portfolio/moscow-golf-club-raevo/g5.webp"
      ],
      "theme": "elite",
      "status": "published"
    },
    {
      "id": "moscow-park-papushevo",
      "slug": "moscow-park-papushevo",
      "year": "2026",
      "fileCode": "DDG-007",
      "category": "parks",
      "title": {
        "ru": "Парк Папушево",
        "en": "Papushevo Park"
      },
      "location": {
        "ru": "Московская область, Россия",
        "en": "Moscow Region, Russia"
      },
      "coordinates": {
        "lat": 55.7558,
        "lng": 37.1173
      },
      "images": [
        "/portfolio/moscow-park-papushevo/p1.webp",
        "/portfolio/moscow-park-papushevo/p2.webp",
        "/portfolio/moscow-park-papushevo/p3.webp",
        "/portfolio/moscow-park-papushevo/p4.webp",
        "/portfolio/moscow-park-papushevo/p5.webp"
      ],
      "theme": "panorama",
      "status": "published"
    },
    {
      "id": "france-residence",
      "slug": "france-residence",
      "year": "2026",
      "fileCode": "DDG-006",
      "category": "residences",
      "title": {
        "ru": "Франция Юг Частная Резиденция",
        "en": "France South Private Residence"
      },
      "location": {
        "ru": "Юг Франции",
        "en": "South of France"
      },
      "coordinates": {
        "lat": 43.7102,
        "lng": 7.262
      },
      "images": [
        "/portfolio/france-residence/f1.webp",
        "/portfolio/france-residence/f2.webp",
        "/portfolio/france-residence/f3.webp",
        "/portfolio/france-residence/f4.webp"
      ],
      "theme": "noir",
      "status": "published"
    },
    {
      "id": "moscow-gazebo-5",
      "slug": "moscow-gazebo-5",
      "year": "2026",
      "fileCode": "DDG-005",
      "category": "residences",
      "title": {
        "ru": "Москва Беседка 5",
        "en": "Moscow Gazebo 5"
      },
      "location": {
        "ru": "Москва, Россия",
        "en": "Moscow, Russia"
      },
      "coordinates": {
        "lat": 55.7558,
        "lng": 37.6173
      },
      "images": [
        "/portfolio/moscow-gazebo-5/IMG_5216.webp",
        "/portfolio/moscow-gazebo-5/IMG_5217.webp",
        "/portfolio/moscow-gazebo-5/IMG_5218.webp",
        "/portfolio/moscow-gazebo-5/IMG_5219.webp",
        "/portfolio/moscow-gazebo-5/IMG_5220.webp"
      ],
      "theme": "magazine",
      "status": "published"
    },
    {
      "id": "germany-residence",
      "slug": "germany-residence",
      "year": "2026",
      "fileCode": "DDG-001",
      "category": "residences",
      "title": {
        "ru": "Германия Частная Резиденция",
        "en": "Germany Private Residence"
      },
      "location": {
        "ru": "Германия",
        "en": "Germany"
      },
      "coordinates": {
        "lat": 51.1657,
        "lng": 10.4515
      },
      "images": [
        "/portfolio/germany-residence/hero.webp",
        "/portfolio/germany-residence/view-1.webp",
        "/portfolio/germany-residence/editorial-1.webp",
        "/portfolio/germany-residence/editorial-2.webp"
      ],
      "status": "published"
    },
    {
      "id": "portfolio-placeholder",
      "slug": "portfolio-placeholder",
      "year": "2026",
      "fileCode": "DDG-000",
      "category": "all",
      "title": {
        "ru": "Портфолио в разработке",
        "en": "Portfolio in progress"
      },
      "location": {
        "ru": "Проекты скоро будут добавлены",
        "en": "Projects will be added soon"
      },
      "coordinates": null,
      "status": "placeholder"
    }
  ],
  "revision": "aa42e5da15b8cdf44eca8e22704d6886d8af2181045bc47f1253551da3013940"
}
